question,option1,option2,option3,option4,option5,stream
"What's your outlook on careers exploring cutting-edge technology, scientific breakthroughs, and innovative solutions?",Opposed,Unenthusiastic,Neutral,Interested,Excited,science
What's your reaction to analyzing financial data?,Opposed,Unenthusiastic,Neutral,Interested,Eager,commerce
What's your feeling about delving into the world of design and creativity?,Opposed,Unenthusiastic,Neutral,Interested,Excited,arts
"When it comes to problem-solving and critical thinking, how do you feel?",Opposed,Unenthusiastic,Neutral,Engaged,Excited,general1
"When presented with a challenge, how do you typically approach finding a solution?",Opposed,Unenthusiastic,Neutral,Engaged,Excited,general2
